{
  "$schema": "../../../../values/schemas/v1/default-review-queue.schema.json",
  "schema_version": 1,
  "spatial_analyzer_target": "2026.1.0529.7",
  "conflict_policy": "Exact SA 2026.1.0529.7 evidence wins. ObjectiveSA is pinned secondary evidence; conflicts remain needs_review.",
  "objective_sa": {
    "repository_url": "https://github.com/spatialanalyzer/ObjectiveSA",
    "commit": "324c73b8e172868b4ccb4a0121e3bd1cbc520c5c",
    "declared_version": "2024.1.5.1",
    "source_layout": "ObjectiveSA/Methods (colocated I*.cs interfaces and implementations)",
    "sha256": "d6107f1e10d2c957198c3cb082368033117e7e2ed2907eafb9eadc40607d295b"
  },
  "summary": {
    "corroborated_default_count": 421,
    "reviewed_no_default_count": 314,
    "needs_review_count": 0,
    "no_candidate_count": 1319
  },
  "entries": []
}
